"school_name","ls","p"
"30TH AVENUE SCHOOL (THE)",0.0806194301333364,0.000425258352755126
"47 AMERICAN SIGN LANGUAGE AND ENGLISH LOWER SCHOOL (THE)",0.0801814714071718,0.000117112163551705
"A D OLIVER MIDDLE SCHOOL",0.0910056913541579,0.000642040442733813
"A J SCHMIDT ELEMENTARY SCHOOL",0.135089592624238,0.000239207823424758
"A M COSGROVE MIDDLE SCHOOL",0.0599356079629122,0.00068772249234618
"A PHILIP RANDOLPH CAMPUS HIGH SCHOOL",0.00118927542617155,0.00126165515202156
"ABRAHAM LINCOLN HIGH SCHOOL",0.00786227447898706,0.00158890474379015
"ACAD FOR COLLEGE PREP & CAREER EXPLORATION: A COLLEGE BOARD SCH",0.00535027508172695,0.000297348613840498
"ACADEMIC LEADERSHIP CHARTER SCHOOL",0.00115496280113943,0.000435225345397824
"ACADEMY FOR CAREERS IN TELEVISION AND FILM",0.0840228698534868,0.000467618071486594
"ACADEMY FOR CONSERVATION AND THE ENVIRONMENT",0.00018604226741616,0.000249174816067457
"ACADEMY FOR ENVIRONMENTAL LEADERSHIP",0.277796134632174,0.000192695191092166
"ACADEMY FOR EXCELLENCE THROUGH THE ARTS (THE)",0.0811165367822165,0.0001436908105989
"ACADEMY FOR HEALTH CAREERS",0.0446515430033945,0.000250005398787681
"ACADEMY FOR LANGUAGE AND TECHNOLOGY",0.943703752239874,0.000264125305031504
"ACADEMY FOR NEW AMERICANS",1.99869097052092,9.05335165045092e-05
"ACADEMY FOR PERSONAL LEADERSHIP AND EXCELLENCE",0.119940670673951,0.000486721474051765
"ACADEMY FOR SCHOLARSHIP AND ENTREPRENEURSHIP",0.031492136151943,0.000304823858322522
"ACADEMY FOR SOFTWARE ENGINEERING",0.0427756540028933,0.000381237468583209
"ACADEMY FOR YOUNG WRITERS",0.0519421638938056,0.000459312244284345
"ACADEMY OF AMERICAN STUDIES",0.0666930631393809,0.000833905051105755
"ACADEMY OF APPLIED MATHEMATICS AND TECHNOLOGY",0.00048573130478022,0.000257480643269705
"ACADEMY OF ARTS AND LETTERS",0.110962293564962,0.000436886510838274
"ACADEMY OF FINANCE AND ENTERPRISE",0.0292815660009373,0.000537387019985481
"ACADEMY OF HOSPITALITY AND TOURISM",0.0169612107933329,0.000156149551402273
"ACADEMY OF INNOVATIVE TECHNOLOGY",0.000627099127726656,0.000354658821536013
"ACADEMY OF PUBLIC RELATIONS",0.0898073806168085,0.000217612672698912
"ACADEMY OF TALENTED SCHOLARS (THE)",0.0124143839553134,0.000322266095447244
"ACADEMY OF THE CITY CHARTER SCHOOL",0.00410373505552608,0.000341369498012416
"ACADEMY OF URBAN PLANNING",0.0425429919864258,0.000192695191092166
"ACADEY OF MEDICAL TECHNOLOGY - A COLLEGE BOARD SCHOOL",0.00652179259768638,0.000515791869259635
"ACCION ACADEMY",0.102094250545435,0.000328910757209043
"ACE ACADEMY FOR SCHOLARS AT THE GERALDINE FERRARO CAMPUS",0.00350252051572762,0.000459312244284345
"ACHIEVEMENT FIRST APOLLO CHARTER SCHOOL",0.0150073085275636,0.0007184540529945
"ACHIEVEMENT FIRST ASPIRE CHARTER SCHOOL",0.0517674968632161,0.000529911775503458
"ACHIEVEMENT FIRST BROWNSVILLE CHARTER SCHOOL",0.0554749816952835,0.000911149244086666
"ACHIEVEMENT FIRST BUSHWICK CHARTER SCHOOL",7.39854512674305e-07,0.000758322023565293
"ACHIEVEMENT FIRST CROWN HEIGHTS CHARTER SCHOOL",0.114425428999269,0.00106895996092939
"ACHIEVEMENT FIRST EAST NEW YORK CHARTER SCHOOL",0.0704860849948846,0.000911979826806891
"ACHIEVEMENT FIRST ENDEAVOR CHARTER SCHOOL",0.0985557218614742,0.000667788507060784
"ACHIEVEMENT FIRST LINDEN CHARTER SCHOOL",0.0966461065463594,0.000466787488766369
"ACHIEVEMENT FIRST NORTH BROOKLYN PREP CHARTER SCHOOL",0.00206527325881779,0.000442700589879848
"ACHIEVEMENT FIRST VOYAGER CHARTER",0.103204180428141,0.000201001018294415
"ACORN COMMUNITY HIGH SCHOOL",0.0306613318663955,0.000126248573474178
"ACTIVE LEARNING ELEMENTARY SCHOOL (THE)",0.536722714136493,0.00034718357705399
"AKRON ELEMENTARY SCHOOL",0.111673264020418,0.000454328747962996
"AKRON HIGH SCHOOL",0.135089592624238,0.000367117562339386
"AKRON MIDDLE SCHOOL",0.135089592624238,0.000284059290316901
"ALBERT SHANKER SCHOOL FOR VISUAL AND PERFORMING ARTS",0.0110307878665214,0.000571440911514701
"ALDEN INTERMEDIATE SCHOOL",0.10155474375865,0.000281567542156226
"ALDEN MIDDLE SCHOOL",0.135089592624238,0.00031479085096522
"ALDEN PRIMARY AT TOWNLINE",0.120455576181051,0.000276584045834877
"ALDEN SENIOR HIGH SCHOOL",0.124714096596662,0.000424427770034901
"ALFRED E SMITH CAREER AND TECHNICAL HIGH SCHOOL",0.0168700816961924,0.000382068051303433
"ALL CITY LEADERSHIP SECONDARY SCHOOL",0.0657239651787876,0.000358811735137138
"ALLEN CREEK SCHOOL",0.0408542110964617,0.000308976771923646
"ALLENDALE ELEMENTARY SCHOOL",0.135089592624238,0.000428580683636025
"ALOMA D JOHNSON CHARTER SCHOOL",0.0943302516801811,0.000215120924538238
"ALTERNATIVE HIGH SCHOOL AT 44",0.0336097610420706,0.000117112163551705
"AMBER CHARTER SCHOOL",0.0219588524783708,0.000436886510838274
"AMBER CHARTER SCHOOL II",0.00138241650514788,0.000296518031120273
"AMERICAN DREAM CHARTER SCHOOL",0.0179132953567528,0.000352167073375339
"AMERICAN SIGN LANGUAGE & ENGLISH SECONDARY SCHOOL",0.0380691028942987,0.000164455378604521
"AMHERST CENTRAL HIGH SCHOOL",0.0655723017479378,0.000715131722113601
"AMHERST MIDDLE SCHOOL",0.0366126508935088,0.000568118580633801
"AMISTAD DUAL LANGUAGE SCHOOL",0.0843007242771954,0.000337216584411291
"AMPARK NEIGHBORHOOD",0.0464318095772721,0.000280736959436001
"ANDERSON SCHOOL (THE)",0.124876007736281,0.00043273359723715
"ANDRIES HUDDE SCHOOL",0.00662511592950631,0.0005747632423956
"ANGELO PATRI MIDDLE SCHOOL (THE)",0.165773017746096,0.000390373878505682
"ANTONIA PANTOJA PREPARATORY ACADEMY",0.000888930493138001,0.000366286979619161
"ARCADIA HIGH SCHOOL",0.0718688309324434,0.000905335165045092
"ARCADIA MIDDLE SCHOOL",0.0650819711039252,0.000642871025454038
"ARCHER ELEMENTARY SCHOOL",0.0479188653700126,0.000387882130345007
"ARCHIMEDES ACADEMY FOR MATH, SCIENCE AND TECHNOLOGY APPLICATIONS",0.00173172565828381,0.000549845760788854
"ARMOR ELEMENTARY SCHOOL",0.100265794524758,0.000267447635912403
"ART AND DESIGN HIGH SCHOOL",0.103808451347878,0.00123756825313503
"ARTURO A SCHOMBURG SATELLITE ACADEMY BRONX",0.00037817691239129,0.000147013141479799
"ASPIRATIONS DIPLOMA PLUS HIGH SCHOOL",0.0574147424327774,0.000162794213164072
"ASTOR COLLEGIATE ACADEMY",0.0133184820811466,0.000416952525552877
"ATHENA HIGH SCHOOL",0.064952834521628,0.000929422063931613
"ATHENA MIDDLE SCHOOL",0.0593249074061066,0.000650346269936062
"ATMOSPHERE ACADEMY PUBLIC CHARTER",0.000579635370236834,0.000338877749851741
"AUGUST MARTIN HIGH SCHOOL",0.0230919386807953,0.000257480643269705
"AUTOMOTIVE HIGH SCHOOL",0.0203345013526186,0.000281567542156226
"AUTUMN LANE ELEMENTARY SCHOOL",0.0096486636004776,0.000240868988865208
"AVIATION CAREER AND TECHNICAL HIGH SCHOOL",0.0605270209713755,0.00174173196431152
"BACCALAUREATE SCHOOL FOR GLOBAL EDUCATION",0.0783983586174282,0.000445192338040522
"BALLET TECH/NYC PUBLIC SCHOOL FOR DANCE",0.0609156051784263,0.000117112163551705
"BANANA KELLY HIGH SCHOOL",0.00950630103296886,0.00028572045575735
"BARCLAY ELEMENTARY SCHOOL",0.061186920274302,0.000382898634023658
"BARD HIGH SCHOOL EARLY COLLEGE",0.135089592624238,0.000509977790218061
"BARD HIGH SCHOOL EARLY COLLEGE QUEENS",0.126486397121592,0.000534064689104582
"BARKER ROAD MIDDLE SCHOOL",0.135089592624238,0.000591374896800097
"BARUCH COLLEGE CAMPUS HIGH SCHOOL",0.102808937282296,0.000395357374827031
"BATTERY PARK CITY SCHOOL",0.0529372899262287,0.00069104482322708
"BAY TRAIL MIDDLE SCHOOL",0.1057574845876,0.000899521086003518
"BAYCHESTER ACADEMY",0.0225197030819732,0.000321435512727019
"BAYCHESTER MIDDLE SCHOOL",0.0295910594109248,0.000231732578942735
"BAYSIDE HIGH SCHOOL",0.00989999668380768,0.00238377240704533
"BEACON HIGH SCHOOL",0.102597030666382,0.00195934463701043
"BEDFORD ACADEMY HIGH SCHOOL",0.0956047078934079,0.000299840362001173
"BEDFORD PARK ELEMENTARY SCHOOL",0.107935449638106,0.000323096678167469
"BEDFORD STUYVESANT COLLEGIATE CHARTER SCHOOL",0.0417462908065392,0.000294856865679824
"BEDFORD STUYVESANT NEW BEGINNINGS CHARTER SCHOOL",0.000477913201884306,0.000583069069597849
"BEGINNING WITH CHILDREN CHARTER SCHOOL II",0.00063401503536367,0.00034220008073264
"BELL ACADEMY",0.0772423985922918,0.000302332110161847
"BELLAIRE SCHOOL (THE)",0.00549735532738919,0.000700181233149553
"BELMONT PREPARATORY HIGH SCHOOL",5.9189334144014e-05,0.000324757843607918
"BEN FRANKLIN ELEMENTARY SCHOOL",0.00706853991624107,0.000411969029231528
"BEN FRANKLIN MIDDLE SCHOOL",0.0429086946303925,0.000543201099027055
"BENJAMIN BANNEKER ACADEMY",0.0868747919602949,0.000677755499703482
"BENJAMIN FRANKLIN HIGH SCHOOL FOR FINANCE AND INFORMATION TECHNOLOGY",1.32492395961046e-06,0.000327249591768593
"BENJAMIN N CARDOZO HIGH SCHOOL",0.0385733998156806,0.00300837061265443
"BENNETT PARK MONTESSORI SCHOOL",0.0684071509204444,0.000520775365580984
"BIG TREE ELEMENTARY SCHOOL",0.110997232836439,0.000437717093558499
"BILINGUAL BICULTURAL SCHOOL (THE)",0.157787317390618,0.000238377240704533
"BILINGUAL CENTER",0.603330484922346,0.000388712713065232
"BLASDELL ELEMENTARY SCHOOL",0.0319710527566683,0.000356319986976463
"BLUEPRINT MIDDLE SCHOOL",0.0249472348643723,0.000555659839830428
"BOSTON VALLEY ELEMENTARY SCHOOL",0.115447569023033,0.000190203442931492
"BOYS AND GIRLS HIGH SCHOOL",0.0219179980126878,0.000357150569696688
"BRIARWOOD SCHOOL",0.110276443070276,0.000140368479718001
"BRIGHTER CHOICE COMMUNITY SCHOOL",0.0312696795429806,0.000207645680056214
"BRIGHTON HIGH SCHOOL",0.0933999327707999,0.000972612365383306
"BRILLA COLLEGE PREP CS-VERITAS",0.0626908292755608,0.000135384983396651
"BRILLA COLLEGE PREPARATORY CHARTER SCHOOL",0.0249564237939916,0.000475093315968617
"BROCKPORT HIGH SCHOOL",0.114083826993807,0.000872111856236098
"BRONX ACADEMY FOR SOFTWARE ENGINEERING (BASE)",0.00769417817915286,0.000343030663452865
"BRONX ACADEMY OF HEALTH CAREERS",0.000650266814262985,0.000299840362001173
"BRONX ACADEMY OF PROMISE CHARTER SCHOOL",0.00476669147357055,0.000497519049414688
"BRONX AEROSPACE HIGH SCHOOL",0.00544540563379509,0.000255819477829255
"BRONX ALLIANCE MIDDLE SCHOOL",0.0241327905815776,0.000249174816067457
"BRONX ARENA HIGH SCHOOL",0.0177982823293777,0.000121265077152829
"BRONX BRIDGES HIGH SCHOOL",1.21289792080404,0.000265786470471954
"BRONX CAREER AND COLLEGE PREPARATORY HIGH SCHOOL",0.0350527285960053,0.000224257334460711
"BRONX CENTER FOR SCIENCE AND MATHEMATICS",0.0258846423509738,0.00037293164138096
"BRONX CHARTER SCH FOR EXCELLENCE 2",0.00546165491104594,0.000194356356532616
"BRONX CHARTER SCH FOR EXCELLENCE 3",0.0279477712051884,0.000194356356532616
"BRONX CHARTER SCH FOR EXCELLENCE 4",0.0357175110299683,8.72111856236098e-05
"BRONX CHARTER SCHOOL FOR BETTER LEARNING",0.0828772651145122,0.000452667582522546
"BRONX CHARTER SCHOOL FOR CHILDREN",0.00627270122984882,0.00034718357705399
"BRONX CHARTER SCHOOL FOR EXCELLENCE",0.00585842643423871,0.000668619089781009
"BRONX CHARTER SCHOOL FOR THE ARTS",0.00616729169424825,0.000357981152416913
"BRONX CHARTER SCHOOL-BETTER LRNING 2",0.0527525332351178,0.000245852485186557
"BRONX COLLABORATIVE HIGH SCHOOL",0.0132090315468072,0.00046180399244502
"BRONX COLLELGIATE ACADEMY",0.0163459474427594,0.000323096678167469
"BRONX COMMUNITY CHARTER SCHOOL",0.00893454135076,0.000422766604594451
"BRONX COMMUNITY HIGH SCHOOL",0.011544355030247,0.000126248573474178
"BRONX COMPASS HIGH SCHOOL",0.00190725148492861,0.000328080174488818
"BRONX DANCE ACADEMY SCHOOL",0.0223202031736169,0.000226749082621386
"BRONX DELTA SCHOOL",0.0116388871190054,0.000242530154305658
"BRONX DESIGN AND CONSTRUCTION ACADEMY",0.00903501295421796,0.000383729216743883
"BRONX EARLY COLLEGE ACADEMY FOR TEACHING AND LEARNING",0.00482981612093745,0.000428580683636025
"BRONX ENGINEERING AND TECHNOLOGY ACADEMY",0.0113738179900133,0.000310637937364096
"BRONX ENVISION ACADEMY",0.0103535875892725,0.000348014159774214
"BRONX GLOBAL LEARNING INSTITUTE FOR GIRLS CHARTER SCHOOL",0.00226788453798864,0.000350505907934889
"BRONX GREEN MIDDLE SCHOOL",0.0337528998500144,0.000335555418970842
"BRONX GUILD HIGH SCHOOL",0.00232960284748667,0.000421936021874227
"BRONX HAVEN HIGH SCHOOL",0.0112726736517703,0.000125417990753953
"BRONX HEALTH SCIENCES HIGH SCHOOL",0.0362309984494961,0.000246683067906782
"BRONX HIGH SCHOOL FOR MEDICAL SCIENCE",0.000795526168533761,0.000350505907934889
"BRONX HIGH SCHOOL FOR THE VISUAL ARTS",0.0246914719084298,0.000392035043946132
"BRONX HIGH SCHOOL FOR WRITING AND COMMUNICATION ARTS",0.00269755377165335,0.000263294722311279
"BRONX HIGH SCHOOL OF BUSINESS",0.197947122542043,0.000228410248061835
"BRONX HIGH SCHOOL OF SCIENCE",0.132745442120415,0.00250835981507906
"BRONX HIGH SCHOOL-LAW AND COMMUNITY SERVICE",1.32926591435989e-05,0.000337216584411291
"BRONX INTERNATIONAL HIGH SCHOOL",1.46811253118968,0.000338047167131516
"BRONX LAB SCHOOL",0.00289730411129148,0.000299840362001173
"BRONX LATIN SCHOOL",0.00118927542617155,0.000488382639492215
"BRONX LEADERSHIP ACADEMY HIGH SCHOOL",0.0196132802551767,0.000451836999802321
"BRONX LEADERSHIP ACADEMY II HIGH SCHOOL",0.000216726414338969,0.000423597187314676
"BRONX LIGHTHOUSE CHARTER SCHOOL",4.93479611188611e-06,0.000560643336151777
"BRONX LITTLE SCHOOL",0.0269408245334438,0.000241699571585433
"BRONX MATHEMATICS PREPARATORY SCHOOL (THE)",0.000718132446025161,0.000191034025651717
"BRONX PARK MIDDLE SCHOOL",0.0230219021221536,0.000339708332571966
"BRONX PREPARATORY CHARTER SCHOOL",0.00862998350894333,0.000586391400478748
"BRONX REGIONAL HIGH SCHOOL",0.00287408167896561,0.000130401487075302
"BRONX RIVER HIGH SCHOOL",0.00339679353063085,0.000354658821536013
"BRONX SCHOOL FOR CONTINUOUS LEARNING",0.0608223932981744,0.000263294722311279
"BRONX SCHOOL FOR LAW, GOVERNMENT AND JUSTICE",0.00169916227887287,0.000626259371049541
"BRONX SCHOOL OF LAW AND FINANCE",0.0213895706125299,0.000299009779280948
"BRONX STUDIO SCHOOL FOR WRITERS AND ARTISTS",8.59147556455091e-05,0.000524097696461884
"BRONX THEATRE HIGH SCHOOL",0.0222798370835858,0.000293195700239374
"BRONX WRITING ACADEMY",0.0505055915298165,0.000331402505369717
"BRONXDALE HIGH SCHOOL",0.0184515901555292,0.000381237468583209
"BRONXWOOD PREPARATORY ACADEMY (THE)",0.00516949584390942,0.000300670944721398
"BROOKLYN ACADEMY HIGH SCHOOL",0.0981548426648851,0.000164455378604521
"BROOKLYN ACADEMY OF GLOBAL FINANCE (THE)",0.000840031242059263,8.88723510640595e-05
"BROOKLYN ACADEMY OF SCIENCE AND THE ENVIRONMENT",0.0279477712051884,0.000313960268244995
"BROOKLYN ARBOR ELEMENTARY SCHOOL",0.00300578294555563,0.000483399143170866
"BROOKLYN ARTS AND SCIENCE ELEMENTARY SCHOOL",0.001316242908897,0.000271600549513528
"BROOKLYN ASCEND CHARTER SCHOOL",0.099083901330008,0.00127743622370583
"BROOKLYN BRIDGE ACADEMY",0.000301479690414469,0.000154488385961823
"BROOKLYN BROWNSTONE SCHOOL",0.0935261563374725,0.000209306845496664
"BROOKLYN CHARTER SCHOOL (THE)",0.015664029603469,0.000173591788526995
"BROOKLYN COLLEGE ACADEMY",0.109762219548187,0.000546523429907955
"BROOKLYN COLLEGIATE-A COLLEGE BOARD SCHOOL",0.0255210049364292,0.000199339852853965
"BROOKLYN COMMUNITY HIGH SCH-COMMUNICATION, ARTS & MEDIA",0.0474877425220819,0.000352997656095564
"BROOKLYN DEMOCRACY ACADEMY",0.0500674892257943,0.000162794213164072
"BROOKLYN DREAMS CHARTER SCHOOL",0.000503872216396906,0.000515791869259635
"BROOKLYN EAST COLLEGIATE CHARTER SCHOOL",0.0383959054721077,0.000257480643269705
"BROOKLYN EMERGING LEADERS ACADEMY CS",0.0650441980988736,9.63475955460832e-05
"BROOKLYN ENVIRONMENTAL EXPLORATION SCHOOL (BEES)",0.0105944241818828,8.22276893022607e-05
"BROOKLYN EXCELSIOR CHARTER SCHOOL",0.0449611744103142,0.000524097696461884
"BROOKLYN FRONTIERS HIGH SCHOOL",0.0372004928553243,0.0001436908105989
"BROOKLYN GARDENS ELEMENTARY SCHOOL",0.0272027607338807,0.000220935003579812
"BROOKLYN GENERATION SCHOOL",9.98051259806544e-05,0.000156980134122498
"BROOKLYN HIGH SCHOOL FOR LAW AND TECHNOLOGY",0.0242962043290182,0.000500010797575363
"BROOKLYN HIGH SCHOOL FOR LEADERSHIP AND COMMUNITY",0.0251075170073689,0.000141199062438225
"BROOKLYN HIGH SCHOOL OF THE ARTS",0.0969781527891564,0.000787392418773163
"BROOKLYN INSTITUTE FOR LIBERAL ARTS",0.0344985643453179,0.000340538915292191
"BROOKLYN INTERNATIONAL HIGH SCHOOL AT WATERS EDGE",0.973645901378586,0.000289873369358475
"BROOKLYN LAB SCHOOL",0.161019900346533,0.00037293164138096
"BROOKLYN LABORATORY CHARTER SCHOOL",0.0620647162267174,0.000570610328794476
"BROOKLYN LANDMARK ELEMENTARY SCHOOL",0.0545361704197409,0.000280736959436001
"BROOKLYN LATIN SCHOOL (THE)",0.135089592624238,0.000582238486877624
"BROOKLYN PREPARATORY HIGH SCHOOL",0.074030545170589,0.000437717093558499
"BROOKLYN PROSPECT CHARTER SCHOOL",0.0719174151499253,0.000642040442733813
"BROOKLYN PROSPECT CHARTER-CSD 13",0.0947606183330157,0.000582238486877624
"BROOKLYN SCHOLARS CHARTER SCHOOL",0.0580873312717579,0.000578085573276499
"BROOKLYN SCHOOL FOR GLOBAL STUDIES",0.116630326921928,0.000205984514615764
"BROOKLYN SCHOOL FOR MATH AND RESEARCH (THE)",0.00405998915803026,0.000230071413502285
"BROOKLYN SCHOOL FOR MUSIC & THEATER",0.0632461449292515,0.000246683067906782
"BROOKLYN SCHOOL OF INQUIRY",0.00306850422499799,0.000443531172600073
"BROOKLYN SCIENCE AND ENGINEERING ACADEMY",0.0610227501777748,0.000264125305031504
"BROOKLYN SECONDARY SCHOOL FOR COLLABORATIVE STUDIES",0.029503397823328,0.000570610328794476
"BROOKLYN STUDIO SECONDARY SCHOOL",0.00386011673749824,0.00077493367796979
"BROOKLYN TECHNICAL HIGH SCHOOL",0.133784273725396,0.00493532252357609
"BROOKLYN THEATRE ARTS HIGH SCHOOL",0.0696019414779749,0.00028572045575735
"BROOKLYN URBAN GARDEN CHARTER SCHOOL",0.0464318095772721,0.000237546657984309
"BROOKS HILL SCHOOL",6.22439198739041e-05,0.000534895271824807
"BROOKSIDE ELEMENTARY SCHOOL CAMPUS",0.0240434949557809,0.000303993275602297
"BROOKVIEW SCHOOL",0.135089592624238,0.000120434494432604
"BROOME STREET ACADEMY CHARTER HIGH SCHOOL",0.0294896887061763,0.000246683067906782
"BROWNSVILLE ACADEMY HIGH SCHOOL",0.061447920775456,8.88723510640595e-05
"BROWNSVILLE ASCEND CHARTER SCHOOL",0.121034565500071,0.000872942438956323
"BROWNSVILLE COLLABORATIVE MIDDLE SCHOOL",0.00109216429591693,0.000231732578942735
"BROWNSVILLE COLLEGIATE  CHARTER SCHOOL",0.009936907950607,0.000293195700239374
"BUCKMAN HEIGHTS ELEMENTARY SCHOOL",0.033530015925437,0.000300670944721398
"BUFFALO ACADEMY FOR THE VISUAL & PERFORMING ARTS",0.088932739073781,0.000601341889442795
"BUFFALO ACADEMY OF SCIENCE CHARTER SCHOOL",0.0110593396008545,0.000582238486877624
"BUFFALO COLLEGIATE CHARTER SCHOOL",0.135089592624238,9.21946819449589e-05
"BUFFALO ELEMENTARY SCHOOL OF TECHNOLOGY",0.243417477621362,0.000451006417082096
"BUFFALO UNITED CHARTER SCHOOL",0.0519183925996588,0.000531572940943907
"BUILD COMMUNITY SCHOOL",0.0185363611873829,0.000295687448400049
"BURGARD VOCATIONAL HIGH SCHOOL",0.00025137015579755,0.000409477281070854
"BUSHWICK ASCEND CHARTER SCHOOL",0.00158153868461658,0.000736726872839447
"BUSHWICK COMMUNITY HIGH SCHOOL",0.0257496114090861,0.000128740321634853
"BUSHWICK LEADERS HS FOR ACADEMIC EXCELLENCE",0.0688068638648457,0.000257480643269705
"BUSHWICK SCHOOL FOR SOCIAL JUSTICE",0.166813896084175,0.000269108801352853
"BUSINESS OF SPORTS SCHOOL",0.00745026530437391,0.000359642317857362
"BUSINESS TECHNOLOGY EARLY COLLEGE HIGH SCHOOL",0.0444859251953609,0.000436055928118049
"CALKINS ROAD MIDDLE SCHOOL",0.0862771912707109,0.000554829257110203
"CAMBRIA HEIGHTS ACADEMY",0.00418899152780972,0.000308146189203421
"CANAL VIEW ELEMENTARY SCHOOL",0.00808354726739589,0.000404493784749505
"CANARSIE ASCEND CHARTER SCHOOL",0.100452484111775,0.0007184540529945
"CAPITAL PREP (CP) HARLEM CHARTER",0.0861759709631084,0.000276584045834877
"CASCADES HIGH SCHOOL",0.0791406992597961,0.000136215566116876
"CASEY MIDDLE SCHOOL",0.0489176597710474,0.000522436531021434
"CASTLE BRIDGE SCHOOL",0.173873034177441,0.000162794213164072
"CATHERINE AND COUNT BASIE MIDDLE SCHOOL 72",0.0207552204616411,0.000284059290316901
"CAYUGA HEIGHTS ELEMENTARY SCHOOL",0.0791510870160435,0.000999191012430501
"CELIA CRUZ BRONX HIGH SCHOOL OF MUSIC (THE)",0.0268975210261487,0.000351336490655114
"CENTRAL BROOKLYN ASCEND CHARTER",0.0201859856408618,0.000459312244284345
"CENTRAL PARK EAST HIGH SCHOOL",0.0806194301333364,0.000425258352755126
"CENTRAL PARK EAST I",0.0309916780650127,0.000127079156194403
"CENTRAL PARK EAST II",0.0533952468700876,0.000373762224101185
"CENTRAL QUEENS ACADEMY CHARTER SCHOOL",0.00638822145955141,0.000348844742494439
"CHALLENGE PREPARATORY CHARTER SCHOOL",0.0618107824945564,0.000656990931697861
"CHANNEL VIEW SCHOOL FOR RESEARCH",0.0741478371123952,0.000798189994136086
"CHARLES A LINDBERGH ELEMENTARY SCHOOL",0.0934673585705965,0.000417783108273102
"CHARLES H ROTH MIDDLE SCHOOL",0.0541833934807978,0.000506655459337162
"CHARLOTTE AVENUE ELEMENTARY SCHOOL",0.135089592624238,0.000219273838139362
"CHARLOTTE SIDWAY SCHOOL",0.0517674968632161,0.00031312968552477
"CHARTER HIGH SCHOOL-LAW AND SOCIAL",0.00348405186364359,0.000350505907934889
"CHARTER SCHOOL FOR APPLIED TECHNOLOGIES",0.0294758264668405,0.00188043927858907
"CHARTER SCHOOL OF INQUIRY",0.0919343205042148,0.00019850927013374
"CHEEKTOWAGA HIGH SCHOOL",0.0596694083438733,0.000569779746074251
"CHEEKTOWAGA MIDDLE SCHOOL",0.0479733383190556,0.000512469538378736
"CHELSEA CAREER AND TECHNICAL EDUCATION HIGH SCHOOL",0.0448165207904131,0.000376253972261859
"CHESTNUT RIDGE ELEMENTARY SCHOOL",0.0512386725467066,0.000452667582522546
"CHILDREN'S AID COLLEGE PREPARATORY CHARTER SCHOOL",0.00577854580554467,0.000486721474051765
"CHILDREN'S LAB SCHOOL (THE)",0.110462215932585,0.000339708332571966
"CHILDREN'S WORKSHOP SCHOOL (THE)",0.0467760892196506,0.000239207823424758
"CHRISTOPHER AVENUE COMMUNITY SCHOOL",0.0285852040703308,0.000196848104693291
"CHURCHVILLE ELEMENTARY SCHOOL",0.135089592624238,0.000323096678167469
"CHURCHVILLE-CHILI MIDDLE SCHOOL",0.0823092740461263,0.000990054602508028
"CHURCHVILLE-CHILI SENIOR HIGH SCHOOL",0.119277481530971,0.00100334392603163
"CINEMA SCHOOL (THE)",0.0298763251526084,0.000264125305031504
"CITY COLLEGE ACADEMY OF THE ARTS",0.0293614417552568,0.000507486042057387
"CITY HONORS SCHOOL AT FOSDICK MASTEN PARK",0.121366657365286,0.000899521086003518
"CITY KNOLL MIDDLE SCHOOL",0.00109216429591693,0.000149504889640474
"CITY POLYTECHNIC HIGH SCHOOL OF ENGINEERING, ARCHITECTURE AND TECHNOLOGY",0.0833843533166057,0.000357150569696688
"CIVIC LEADERSHIP ACADEMY",0.0220606200713213,0.000490874387652889
"CLARA BARTON HIGH SCHOOL",0.0118419268096865,0.00100666625691252
"CLAREMONT INTERNATIONAL HIGH SCHOOL",1.21292889125771,0.000283228707596676
"CLARENCE CENTER ELEMENTARY SCHOOL",0.135089592624238,0.000312299102804546
"CLARENCE MIDDLE SCHOOL",0.117326947683694,0.000865467194474299
"CLARENCE SENIOR HIGH SCHOOL",0.124337389578749,0.00121846485056986
"CLEVELAND HILL ELEMENTARY SCHOOL",0.0335107488962887,0.000484229725891091
"CLEVELAND HILL HIGH SCHOOL",0.0803203514462658,0.000328080174488818
"CLEVELAND HILL MIDDLE SCHOOL",0.0362702783888751,0.00022924083078206
"CLINTON ELEMENTARY SCHOOL",0.0777743289158778,0.000963475955460832
"CLOVERBANK ELEMENTARY SCHOOL",0.135089592624238,0.000464295740605694
"COBBLE HILL SCHOOL OF AMERICAN STUDIES",0.00132605473220692,0.000485060308611316
"COBBLES ELEMENTARY SCHOOL",0.0605920981228782,0.000465126323325919
"COLDEN ELEMENTARY SCHOOL",0.135089592624238,0.000137876731557326
"COLEBROOK SCHOOL",0.135089592624238,0.000135384983396651
"COLLABORATIVE ARTS MIDDLE SCHOOL",0.0312815415962688,0.000271600549513528
"COLLEGE ACADEMY (THE)",0.436459986737888,0.000352167073375339
"COLLEGE POINT COLLABORATIVE",5.52942180757901e-05,0.000127909738914628
"COLLEGIATE ACADEMY-MATH-PERSONAL AWA",0.100656247432233,9.05335165045092e-05
"COLLEGIATE INSTITUTE FOR MATH AND SCIENCE",0.0541053278609952,0.000505824876616937
"COLUMBIA SECONDARY SCHOOL",0.111340568680821,0.000594697227680996
"COMMUNITY ACTION SCHOOL-MS 258",0.0424473861930776,0.000199339852853965
"COMMUNITY HEALTH ACADEMY OF THE HEIGHTS",0.00901439407191564,0.000580577321437174
"COMMUNITY PARTNERSHIP CHARTER SCHOOL",0.0671625381038817,0.000337216584411291
"COMMUNITY ROOTS CHARTER SCHOOL",0.0866632540252544,0.000392865626666357
"COMMUNITY SCHOOL #53 AT #4",0.00105488012169971,0.000357981152416913
"COMMUNITY SCHOOL FOR SOCIAL JUSTICE",0.0203521019821107,0.00025997239143038
"COMMUNITY VOICES MIDDLE SCHOOL",0.0100725984674938,0.000284059290316901
"COMO PARK ELEMENTARY SCHOOL",0.104799702739278,0.000323096678167469
"COMPASS CHARTER SCHOOL",0.0583527846734433,0.000249174816067457
"COMPREHENSIVE MODEL SCHOOL PROJECT MS 327",0.0011369947417449,0.000607155968484369
"CONCOURSE VILLAGE ELEMENTARY SCHOOL",0.00405667367631007,0.000264125305031504
"CONEY ISLAND PREPARATORY PUBLIC CHARTER SCHOOL",0.0316214883090683,0.000836396799266429
"CONSELYEA PREPARATORY SCHOOL",0.0408284627625812,0.000405324367469729
"CORNERSTONE ACADEMY FOR SOCIAL ACTION",0.0437688073936754,0.000286551038477575
"CORNERSTONE ACADEMY FOR SOCIAL ACTION MIDDLE SCHOOL",0.0775363232845306,0.000217612672698912
"CORONA ARTS AND SCIENCES ACADEMY",0.0387351070483703,0.000627920536489991
"COUNCIL ROCK PRIMARY SCHOOL",0.00280681593680334,0.000568949163354026
"COUNTRY PARKWAY ELEMENTARY SCHOOL",0.00600502740093557,0.000450175834361872
"COURT STREET ELEMENTARY SCHOOL",0.102674751597926,0.000294856865679824
"CRAIG HILL ELEMENTARY SCHOOL",0.0196854743150896,0.000252497146948356
"CRESTON ACADEMY",0.101678188650918,0.000379576303142759
"CROTONA INTERNATIONAL HIGH SCHOOL",1.65179267327564,0.000272431132233753
"CULTURAL ACADEMY FOR THE ARTS AND SCIENCES",0.00133388094751126,0.000235054909823634
"CULTURAL ARTS ACADEMY CHARTER SCHOOL AT SPRING CREEK",0.104506766109883,0.000212629176377563
"CYNTHIA JENKINS SCHOOL",0.0500674892257943,0.000325588426328143
"CYPRESS HILLS ASCEND CHARTER",0.010674358444938,0.000102992257307882
"CYPRESS HILLS COLLEGIATE PREPARATORY SCHOOL",0.0296824127030159,0.000248344233347232
"D'YOUVILLE-PORTER CAMPUS",0.345504736069075,0.00051496128653941
"DAKE JUNIOR HIGH SCHOOL",0.0684540057419916,0.000451836999802321
"DAVID B CRANE ELEMENTARY SCHOOL",0.00756088571647517,0.000294856865679824
"DEMOCRACY PREP ENDURANCE CHARTER SCHOOL",0.0284088172649586,0.000543201099027055
